<?xml version="1.0" encoding="UTF-8" standalone="no"?><CdmNewTradeWorkflow xmlns="urn:icma:xsd:ICMARepoNewTrade" xmlns:xsi="http://www.w3.org/2001/XMLSchema-instance" xsi:schemaLocation="urn:icma:xsd:ICMARepoNewTrade icma-cdm-repo-trade.xsd"><Workflow><WorkflowName>ICMARepoWorkflow</WorkflowName><WorkflowStep><WorkflowStepName>NewTrade</WorkflowStepName><TransactionDate>2024-01-18</TransactionDate><PurchaseDate>2024-01-18</PurchaseDate><RepurchaseDate>2024-01-19</RepurchaseDate><TradeIdentifier><UTI>1001</UTI></TradeIdentifier><TradeType>REPURCHASE</TradeType><Seller><LEIName>SL-BANK</LEIName><LEI>7245009UXRIGIRYOBR48</LEI></Seller><Buyer><LEIName>BY-BANK</LEIName><LEI>8IBZUGJ7JPLH368JE346</LEI></Buyer><TermType>TERM</TermType><RateType>FIXED</RateType><DayCount>ICMA_365</DayCount><CollateralList><Collateral><Description>GILT .5 22/07/2022</Description><ISIN>GB00BD0PCK97</ISIN><Currency>GBP</Currency><NominalPerUnitAmount>1000</NominalPerUnitAmount><DayCount>ICMA_365</DayCount><InterestRate>.5</InterestRate><InterestPaymentFrequency>SA</InterestPaymentFrequency><NominalAmount>10000</NominalAmount><CleanPrice>100.75</CleanPrice><AccruedInterestPrice>0.0566</AccruedInterestPrice><AccruedInterestAmount>5660.00</AccruedInterestAmount><DirtyPrice>100.8066</DirtyPrice><UnAdjustedSettlementValue>10080660.00</UnAdjustedSettlementValue><Margin>100.00</Margin><AdjustedSettlementValue>10080660.00</AdjustedSettlementValue><Haircut>2</Haircut><SettlementAmount>9879046.80</SettlementAmount></Collateral></CollateralList><Loan><LoanAmount>9879046.80</LoanAmount><LoanCurrency>GBP</LoanCurrency></Loan><RepoRate><FixedRate><Value>0.4</Value></FixedRate><Floating><FloatingRateIndex/><FloatingRateIndexFreq/><FloatingRateIndexRate/><FloatingRateIndexSpread/></Floating></RepoRate><PurchasePrice>9879046.80</PurchasePrice><ProjectedInterest>108.26</ProjectedInterest><RepurchasePrice>9879155.06</RepurchasePrice><Optionality><TerminationOnDemand>N</TerminationOnDemand><NoticePeriod>2</NoticePeriod></Optionality><DeliveryMethod>DVP</DeliveryMethod><Substitution><Allowed>N</Allowed><NumberAllowed>0</NumberAllowed></Substitution><Agreement><AgreementName>GMRA</AgreementName><AgreementIssuer>ICMA</AgreementIssuer><AgreementGoverningLaw>UK</AgreementGoverningLaw><AgreementDate>2011</AgreementDate><AgreementVersion>2011</AgreementVersion><AgreementIdentifier/><AgreementEffectiveDate/><AgreementUrl/></Agreement><InitialMargin><Value>201613.20</Value></InitialMargin></WorkflowStep></Workflow></CdmNewTradeWorkflow>